{"assertion":{"kind":"theoretical","text":"Formal-Conjectures statement: Erdos264.erdos_264.variants.ko_tao_neg https://google-deepmind.github.io/formal-conjectures/theorem/?name=Erdos264.erdos_264.variants.ko_tao_neg."},"claim_id":"vcl_6b7736bc99918aee6ef5c3870861e3585cb1d07f4eaf199e4f4755b0375b9327","conditions":[],"created_at":"2026-06-16T00:00:00Z","evidence":[],"provenance":[{"kind":"database_record","title":"erdos_corpus:fc:264"}],"relations":[{"kind":"synthesized_from","target_claim_id":"vcl_a9601802c65da247739eec2247cfcc5ae3016961673d346227af4e469f36fe82"}],"revision":1,"schema":"vela.claim-record.v1"}